{
  "$id": "https://hsync.dev/protocol/p2p/1",
  "$schema": "https://json-schema.org/draft/2020-12/schema",
  "additionalProperties": false,
  "description": "Contract for the mDNS service TXT record. All values are strings (mDNS encoding). Generated from hsync_common.protocol.schemas.",
  "properties": {
    "bucket": {
      "type": "string"
    },
    "cert_fp": {
      "description": "TLS certificate fingerprint.",
      "type": "string"
    },
    "cid": {
      "type": "string"
    },
    "compression": {
      "enum": [
        "true"
      ],
      "type": "string"
    },
    "connected": {
      "description": "Count of clients currently connected to this bucket's share (master included). Present only on a serving master; informational, never part of the election.",
      "pattern": "^[0-9]+$",
      "type": "string"
    },
    "delta": {
      "enum": [
        "true"
      ],
      "type": "string"
    },
    "group": {
      "type": "string"
    },
    "heartbeat": {
      "description": "Monotonic liveness counter, incremented on every periodic re-announce. Opaque: receivers only rely on it changing so their staleness sweep sees fresh records for otherwise quiescent peers. Never part of the election.",
      "pattern": "^[0-9]+$",
      "type": "string"
    },
    "https": {
      "enum": [
        "true"
      ],
      "type": "string"
    },
    "never_master": {
      "enum": [
        "true"
      ],
      "type": "string"
    },
    "peer_download": {
      "description": "This node implements LAN inventory, batch source lookup and read-only seeder semantics (ADR-0028).",
      "enum": [
        "true"
      ],
      "type": "string"
    },
    "prefer_master": {
      "enum": [
        "true"
      ],
      "type": "string"
    },
    "protocol": {
      "const": "p2p/1"
    },
    "server_ready": {
      "enum": [
        "true"
      ],
      "type": "string"
    },
    "startup_time": {
      "description": "Unix start time; earlier wins master election.",
      "pattern": "^[0-9]+(\\.[0-9]+)?$",
      "type": "string"
    },
    "sync_direction": {
      "type": "string"
    },
    "version": {
      "description": "Semantic app version (informational).",
      "type": "string"
    }
  },
  "required": [
    "cid",
    "bucket",
    "version",
    "protocol",
    "startup_time",
    "sync_direction"
  ],
  "title": "HSYNC p2p mDNS/TXT record (p2p/1)",
  "type": "object"
}
