{
  "bucket": "bucket-1",
  "cert_fp": "0123456789abcdef0123456789abcdef0123456789abcdef0123456789abcdef",
  "cid": "TestClientA1234567890",
  "heartbeat": "8",
  "https": "true",
  "peer_download": "true",
  "protocol": "p2p/1",
  "startup_time": "1700000001",
  "sync_direction": "download-only",
  "version": "1.0.0"
}
